{"catalog_digest":"sha256:4fa6c813f3f15d1995d21b5fc988302933688627836ff11594a5034650391a9a","digest_algorithm":"canonical-json/v1","generator_contract_version":"module-manifest-generator/v1","schema_version":"capability-source-catalog/v1","sources":[{"digest_algorithm":"canonical-json/v1","files":[{"path":"schemas/host-benchmark/observation.schema.json","sha256":"sha256:a80998eab2723b77f22fc5b1b7da9d458f04867e5edbbb076161a6ca7f371f6a"},{"path":"schemas/model-eval-observation.schema.json","sha256":"sha256:147a849da3617fc07f2d9c2d08517091cf81ab44aa8dcda3d027e5e63772822a"},{"path":"scripts/benchmark-harness.ps1","sha256":"sha256:3a0f5c35fd1d1e78168d5d7798cad8a95c261f848040e20824a244e3af7c1915"},{"path":"scripts/host-benchmark/HostBenchmark.Otel.ps1","sha256":"sha256:0a31012efe61826baccde55191656460dec861d5fed869929153dd13f7c8bfe5"},{"path":"scripts/host-benchmark/HostBenchmark.Trial.ps1","sha256":"sha256:68bd125c6eb9543bb0b0795fd4ae333c64c40c9dd507cacc116a3453c11527db"},{"path":"scripts/lib/Harness.ModelEval.psm1","sha256":"sha256:6bf6d14f523137c6e5359d391d5119ee78cf1eccfbe1c87f855d3bfccd44d71e"},{"path":"scripts/receive-otlp-http.ps1","sha256":"sha256:e850a086dc7ea051b95e0c861d21858c6b9a2987b5a5324e48e3580eaa62a30b"},{"path":"scripts/run-host-benchmark.ps1","sha256":"sha256:136998f6f59526aa19178668568690fd553b103a7ddd7d34c0f1c9ffbebef4dc"},{"path":"scripts/run-model-evals.ps1","sha256":"sha256:379e1170b198f7f1ed591fc57c0e610aa21acff30fee7a559953d285650d7fdc"},{"path":"tests/evals/core-scenarios.json","sha256":"sha256:26ef2f1da1372df60aec739b6f8ee1191e8984f305a8db48d3c1e5b29f56c22e"},{"path":"tests/run-scenario-evals.ps1","sha256":"sha256:aa2de18ef19c8bb0bff3383b8a86941066fb129917500649e5937550b09a5201"},{"path":"tests/scenarios/baseline/clear-low-risk-single-file.json","sha256":"sha256:53b8e81e576724dbfe3754ca945d92a5b0a8bc5edfc108ed71f7e54ff9de49f9"},{"path":"tests/scenarios/direct/route-cases.json","sha256":"sha256:132c02b432fdad7a39f50b4928457424efc52ee60577f0d1757ea18d84ff0625"},{"path":"tests/scenarios/entry-contract/v1-routing.json","sha256":"sha256:6cee43226397b96f93db8917b7ea469213b0eeef4937b84f9374d5dc2eab5276"},{"path":"tests/scenarios/requirement-gate/inspect-cases.json","sha256":"sha256:bd79799d24eaa11e1990f1f12cd06ab4e0b7b369ea790a11b3df487710bbb3cc"}],"manifest_digest":"sha256:528de5464a147b4b2d9487b10661b1c13a7844b400f246236d5c401019a64b06","module_id":"benchmark","module_version":"1.0.0","schema_version":"capability-source/v1","source_basis":"git-index-blob/v1","source_digest":"sha256:14496fdcbc8650714c41692d3e5db5bca9c6980a02ae34063c048f1b48a7c189"},{"digest_algorithm":"canonical-json/v1","files":[{"path":"schemas/adapter-inventory.schema.json","sha256":"sha256:391654a1ac0846a0ed549675ab15cdeee1b94e3473ace4d0f27cc9d88f3f6ae8"},{"path":"schemas/capability-source-catalog.schema.json","sha256":"sha256:2b37f7a86b4404a3003bc42aadbf0ac5b5283c44e1feae0f30b00fe677c4663f"},{"path":"schemas/capability-source.schema.json","sha256":"sha256:8d8d740ad31cc0b2e3321f52b6b785b93801e35631e1a84246b7cc3317db094c"},{"path":"schemas/module-manifest-catalog-v1.schema.json","sha256":"sha256:bc9cb61da933af16f58c9656b7ae6d4438f284be663ece4c85dcd9e525a392c8"},{"path":"schemas/module-manifest-catalog.schema.json","sha256":"sha256:54ff7699384d52269f0a24aead6e02fd9e25fc82a6ac8eda6c95ca8a3c339c64"},{"path":"schemas/module-manifest-v1.schema.json","sha256":"sha256:2598935579d04899862329b3edf6ccc710fce8122a7105e29b910566b9657475"},{"path":"schemas/module-manifest.schema.json","sha256":"sha256:adb95bc3276d6e383826064c414a0ca6156108b120f650e390ad73f203e81a66"},{"path":"schemas/ordinary-ci-receipt.schema.json","sha256":"sha256:4b0ad49f16d69f8e6f9dd6d803e33040147551f4638ad07bd0ec2498a0e0804f"},{"path":"scripts/audit-task-artifact-drift.ps1","sha256":"sha256:536540d04981672ed89a3dd0534c0f64dcc9adc28976f3fdf7ceed5a418a7e14"},{"path":"scripts/get-adapter-inventory.ps1","sha256":"sha256:834f3a8128bd47d57d0450a156ff4b979cf94b792c80f57923e07f0fb156c2e6"},{"path":"scripts/get-kernel-tcb-inventory.ps1","sha256":"sha256:bba5c167829e2487916b23830250c0b7286719f884404387bb81f4f37bf4924a"},{"path":"scripts/get-module-manifest-catalog.ps1","sha256":"sha256:41e2ac5cb2e9835f346cdc40e1e2b43b7369b0480f0eb6d4794608b52529b8b7"},{"path":"scripts/get-repo-inventory.ps1","sha256":"sha256:b7556ed854644581e98b04fabf9f94ab099e177b15cf0c52e5a3ff5f3f26d282"},{"path":"scripts/invoke-validation-check.ps1","sha256":"sha256:ff72e3a176df440076359a8ca69d6782c208b0c308a126a41d8a97121a8ce2c0"},{"path":"scripts/lib/Harness.CapabilitySource.psm1","sha256":"sha256:c7faab0431b6dace5896cb3037ba258cf45b87a50cae1f573da1db38fb289cac"},{"path":"scripts/lib/Harness.ModuleManifest.psm1","sha256":"sha256:b734e8fc3accd4ab3cd421d3c5f4b4885cd7be064b264e33344313f2fb7aaf0b"},{"path":"scripts/lib/Harness.ValidationJob.cs","sha256":"sha256:ddd8a04740cabd6f1e09fd0e0d0176876eff0e1cc82d219c83696ed8612a5a10"},{"path":"scripts/lib/Harness.ValidationProcess.ps1","sha256":"sha256:e48b40fd243ee29453d85a2ec1a6f8fe606e8ed0cee866a9722bd921ae37a1a8"},{"path":"scripts/run-changed-optional-validation.ps1","sha256":"sha256:a72e85a3c72a7216a82ff6a7ef08141a1652fb1bc57350cfb97c1084d4f8dc4d"},{"path":"scripts/run-validation.ps1","sha256":"sha256:264089734bdca7eaa035e1c05f58e861900fa50325a1f341672c983df4bd13e0"},{"path":"scripts/write-ordinary-ci-receipt.ps1","sha256":"sha256:f15a282dea8f1c8f9076de114b90f7aa199288f01f4404ee2a0cc5adc8be3e77"},{"path":"tests/fixtures/tk02/cycle/alpha-cycle/module.manifest.json","sha256":"sha256:8125da25f7f8081052d580bf58dc97815f44997353b3d301d2846917de08f87c"},{"path":"tests/fixtures/tk02/cycle/beta-cycle/module.manifest.json","sha256":"sha256:ac1e56b131195fb6a19d2895f8af3df368f212f64aa406272314af827ccf6a3e"},{"path":"tests/fixtures/tk02/duplicate-id/alpha-module/module.manifest.json","sha256":"sha256:4bc14255e62313e26a384c293eaecd458c16329d2c883826d11846b8fbd83fc7"},{"path":"tests/fixtures/tk02/duplicate-id/beta-folder/module.manifest.json","sha256":"sha256:d601fb4efe0b949fce8e63e9d287ff1bdc6932cbd7ae6193083ce874471acdcc"},{"path":"tests/fixtures/tk02/invalid-schema/invalid-module/module.manifest.json","sha256":"sha256:35710f30d86930f329d29b834c403ccc4e89e75bdfc9b770c901a365ef5792fb"},{"path":"tests/fixtures/tk02/missing-dependency/orphan-module/module.manifest.json","sha256":"sha256:98078008b394dcfe3d5ddc47363c57815f9f7cbdc8554093dfe7ff7f93651755"},{"path":"tests/fixtures/tk02/missing-reference/orphan-reference/module.manifest.json","sha256":"sha256:9abbd591210b4e43826742bef9d3226e3b2b078b85cd78c51afeff58dc1832aa"},{"path":"tests/fixtures/tk02/multi-owner/alpha-tests/module.manifest.json","sha256":"sha256:70649ca7d7429249d69e23e8e6cfedfa3d9ccf54ff9985d4376f385629c530f4"},{"path":"tests/fixtures/tk02/multi-owner/beta-tests/module.manifest.json","sha256":"sha256:147ee74d9511aa9869ab3defdd41b072202cdbe8a5b840293c611880b644cadf"},{"path":"tests/fixtures/tk02/overlap/alpha-owner/module.manifest.json","sha256":"sha256:416a63d7eb655c8330a454b89eab31b295716b911a62f2d3251035779bf94a4e"},{"path":"tests/fixtures/tk02/overlap/beta-owner/module.manifest.json","sha256":"sha256:f307c0666ad6a1d45e4af4c9015abad4df8de4fa4769f01239397455950837f6"},{"path":"tests/fixtures/tk02/stale-catalog.json","sha256":"sha256:ca3d163bab055381827226140568f3bef7eaac187cebd76878e0b63e9e442356"},{"path":"tests/fixtures/tk02/valid/alpha-module/module.manifest.json","sha256":"sha256:2fb96d273eccefb4527045f72dc6ba973fc1f0d24ee0ac62d94c6e4db4e28466"},{"path":"tests/fixtures/tk02/valid/beta-module/module.manifest.json","sha256":"sha256:015aa236ef3825daa7200efb722d2c8288ee18dbcefb0856ba2375c06f546779"},{"path":"tests/fixtures/tk03/archive-active-route/archived-legacy/module.manifest.json","sha256":"sha256:f6597d223c4d6f66452af9dc7d59936dd9a2e31495b92b4270c5765879d551c2"},{"path":"tests/fixtures/tk03/archive-core-group/archived-legacy/module.manifest.json","sha256":"sha256:42ffac4e57af9363049a4b93c65a48f9fde71bea3dcee36168cded0d5055fbe6"},{"path":"tests/fixtures/tk03/archive-nonlegacy/archived-legacy/module.manifest.json","sha256":"sha256:24dadd93b4de4a85a9aea8c552fc3f07c57f2601bfed66c385d3b6c408ae8c91"},{"path":"tests/fixtures/tk03/archive-unowned-test/archived-legacy/module.manifest.json","sha256":"sha256:f8615862769131fe542b36b1cf3d6181ac9efbf4c58ec1c0ad3784df9dc83710"},{"path":"tests/fixtures/tk03/valid-archive/archived-legacy/module.manifest.json","sha256":"sha256:611ba9383d7782cd4a7be8bf862d418033c79ebc68d1ea590353cdddc7952b1d"},{"path":"tests/fixtures/tk04/duplicate-owner/alpha-capability/module.manifest.json","sha256":"sha256:a5527e61bca40a3cd8afee3fe8bea2711eaf698bd5ccd0e58eb5054691fee0a7"},{"path":"tests/fixtures/tk04/duplicate-owner/beta-capability/module.manifest.json","sha256":"sha256:e1f3c0e6fb95141bb761410224c78ccf80c69d6812ca7753e412f6d914262c6b"},{"path":"tests/fixtures/tk04/index-flags.ps1","sha256":"sha256:1a90a76f1b4b7af3877b92872e2d21259cb96ff6ae4e472f2f8c9bba12ee2927"},{"path":"tests/fixtures/tk04/invalid-export/export-not-code/module.manifest.json","sha256":"sha256:3c7ac37de1b5481b946af4ebb56a514cd28dfca6b5733811f414724c1ebb69a1"},{"path":"tests/fixtures/tk04/invalid-incomplete/incomplete-package/module.manifest.json","sha256":"sha256:460a4395c965016e10f6090f3ef209f2ba92769dfaad8b8ed04f2c018d201ae7"},{"path":"tests/fixtures/tk04/invalid-role-overlap/role-overlap/module.manifest.json","sha256":"sha256:d8ccd13f8f655db0b886d59ead4d4f03b163ce67646ab310d14adf892dd06e35"},{"path":"tests/fixtures/tk04/invalid-schema/bad-version/module.manifest.json","sha256":"sha256:4a26602c3a2aa2b4a38202c2ac4faa60cd3191ed95fe1f850279775a632b0cce"},{"path":"tests/fixtures/tk04/invalid-schema/unknown-field/module.manifest.json","sha256":"sha256:e997be6446bfb43c3ae4821721adcd3f20f9f27399f3325d1261c427e3272745"},{"path":"tests/fixtures/tk04/missing-path/missing-package/module.manifest.json","sha256":"sha256:6d4db9022cc8c85ebe517d0948527603575009d6c21d8c269068022a00151933"},{"path":"tests/fixtures/tk04/mixed/sample-capa